ireland to win ireland vs england football match,ireland vs england football match,30.00,true,unsettled
england to win ireland vs england football match,ireland vs england football match,30.00,true,unsettled
ireland to win ireland vs germany football match,ireland vs germany football match,60.00,true,unsettled
germany to win ireland vs germany football match,ireland vs germany football match,70.00,true,unsettled
ireland to win ireland vs england hockey match,ireland vs england hockey match,80.00,true,unsettled
england to win ireland vs england hockey match,ireland vs england hockey match,20.00,true,unsettled